{
  "schema_version": 1,
  "jurisdiction": "us-ca",
  "status": "draft",
  "reviewed_by": [],
  "reviewed_at": null,
  "records_law": {
    "name": "California Public Records Act",
    "citation": "Gov. Code § 7920.000 et seq. (recodified by AB 473, Stats. 2021, ch. 614; operative 2023-01-01)",
    "determination_days": 10,
    "determination_extension_days": 14,
    "day_type": "calendar",
    "fee_basis": "Fees may cover direct duplication costs or an applicable statutory fee. Free own-equipment copying on agency premises applies to disclosable records without physical contact, but not methods that damage records or permit unauthorized computer-system or secured-network access. Necessary reasonable record-safety and orderly-function limits, and necessary historic/high-value record integrity or preservation limits, remain applicable (Gov. Code § 7922.530(a)-(c)).",
    "appeal": "No administrative appeal. Any person may institute a proceeding for injunctive or declaratory relief or a writ of mandate in a court of competent jurisdiction (Gov. Code § 7923.000 et seq.). The 10-day determination period runs from receipt of the request (§ 7922.535(a)); one written extension of no more than 14 days is allowed only for enumerated unusual circumstances (§ 7922.535(b)-(c)). The determination deadline is not a production deadline. Date outputs are provisional reminders only: establish actual copy-request receipt, applicable last-day holiday rules (Gov. Code §§ 6800, 6700 and related provisions), and a lawful, reasonably necessary written extension notice from the agency head or designee stating reasons and expected dispatch date. A send date is not proof of receipt; a reminder is not a finding of lateness.",
    "sources": [
      {
        "title": "Gov. Code § 7920.000 (short title; AB 473 operative 2023-01-01)",
        "url": "https://leginfo.legislature.ca.gov/faces/codes_displaySection.xhtml?lawCode=GOV&sectionNum=7920.000.",
        "accessed": "2026-09-30"
      },
      {
        "title": "Gov. Code § 7922.535 (AB 370, Stats. 2025, ch. 34, § 1; effective 2026-01-01; current version)",
        "url": "https://leginfo.legislature.ca.gov/faces/codes_displaySection.xhtml?lawCode=GOV&sectionNum=7922.535.",
        "accessed": "2026-10-02"
      },
      {
        "title": "Gov. Code § 7922.530(a)-(c) (AB 473; operative 2023-01-01; copying conditions)",
        "url": "https://leginfo.legislature.ca.gov/faces/codes_displaySection.xhtml?lawCode=GOV&sectionNum=7922.530.",
        "accessed": "2026-10-02"
      },
      {
        "title": "Gov. Code § 7923.000 (enforcement proceeding)",
        "url": "https://leginfo.legislature.ca.gov/faces/codes_displaySection.xhtml?lawCode=GOV&sectionNum=7923.000.",
        "accessed": "2026-09-30"
      },
      {
        "title": "Gov. Code § 6800 (first-day exclusion; last-day holiday exclusion)",
        "url": "https://leginfo.legislature.ca.gov/faces/codes_displaySection.xhtml?lawCode=GOV&sectionNum=6800.",
        "accessed": "2026-10-02"
      },
      {
        "title": "Gov. Code § 6700 (current holiday list; AB 2156 effective 2026-03-26; historical/local applicability still requires review)",
        "url": "https://leginfo.legislature.ca.gov/faces/codes_displaySection.xhtml?lawCode=GOV&sectionNum=6700.",
        "accessed": "2026-10-02"
      }
    ]
  },
  "rules": [
    {
      "rule_id": "ca-civ-1798.90.5-definitions",
      "citation": "Civ. Code § 1798.90.5",
      "actor": "Any person, including a public agency",
      "activity": "operate or access an ALPR system",
      "duty": "Definitional scope for Title 1.81.23: an 'ALPR system' is a searchable computerized database resulting from one or more mobile or fixed cameras combined with algorithms that convert plate images to computer-readable data; an 'ALPR operator' operates such a system; an 'ALPR end-user' accesses or uses one; 'ALPR information' is data collected through an ALPR system; 'public agency' means the state or any city, county, or agency or political subdivision of the state, including a law enforcement agency. Out-of-state and federal agencies are not 'public agencies' under subdivision (f).",
      "exceptions": [
        "Transportation agencies subject to Sts. & Hy. Code § 31490 are not ALPR operators or end-users.",
        "End-user excludes persons subject to 15 U.S.C. §§ 6801-6809 and implementing state or federal statutes or regulations, if subject to state or federal regulatory compliance oversight for those sections; it also excludes a person other than a law enforcement agency to whom information may be disclosed as a permissible use under 18 U.S.C. § 2721. Eligibility, not actual receipt, is the latter predicate. Federal cross-reference eligibility remains unresolved and requires qualified human legal review."
      ],
      "remedy": "Definitions only; remedies attach through Civ. Code § 1798.90.54.",
      "effective_from": "2016-01-01",
      "effective_to": null,
      "sources": [
        {
          "title": "Civ. Code § 1798.90.5 (Added by Stats. 2015, ch. 532, § 3 (SB 34), effective 2016-01-01)",
          "url": "https://leginfo.legislature.ca.gov/faces/codes_displaySection.xhtml?lawCode=CIV&sectionNum=1798.90.5.",
          "accessed": "2026-10-02"
        }
      ],
      "review": "needs_attorney_review"
    },
    {
      "rule_id": "ca-civ-1798.90.51-security-procedures",
      "citation": "Civ. Code § 1798.90.51(a)",
      "actor": "ALPR operator",
      "activity": "operate an ALPR system",
      "duty": "Maintain reasonable security procedures and practices, including operational, administrative, technical, and physical safeguards, to protect ALPR information from unauthorized access, destruction, use, modification, or disclosure.",
      "exceptions": [],
      "remedy": "Civil action by a harmed individual against a person who knowingly caused the harm (Civ. Code § 1798.90.54).",
      "effective_from": "2016-01-01",
      "effective_to": null,
      "sources": [
        {
          "title": "Civ. Code § 1798.90.51 (Added by Stats. 2015, ch. 532, § 3 (SB 34), effective 2016-01-01)",
          "url": "https://leginfo.legislature.ca.gov/faces/codes_displaySection.xhtml?lawCode=CIV&sectionNum=1798.90.51.",
          "accessed": "2026-09-30"
        }
      ],
      "review": "verified"
    },
    {
      "rule_id": "ca-civ-1798.90.51-usage-and-privacy-policy",
      "citation": "Civ. Code § 1798.90.51(b)",
      "actor": "ALPR operator",
      "activity": "operate an ALPR system",
      "duty": "An operator must implement a privacy and usage policy respecting privacy and civil liberties across collection, use, maintenance, sharing and dissemination. Make it publicly available in writing and conspicuous online if the operator has a website. Minimum contents: (A) authorized system-use and collection purposes; (B) job titles or designations of employees and independent contractors authorized to use or access the system or collect ALPR information, and training requirements; (C) security and privacy-law monitoring; (D) sale, sharing and transfer purposes, processes and restrictions; (E) title of the ALPR-system custodian or owner responsible for implementing this section; (F) reasonable accuracy and error-correction measures; (G) retention length and the process for determining if and when to destroy retained information.",
      "exceptions": [],
      "remedy": "Civil action by a harmed individual against a person who knowingly caused the harm (Civ. Code § 1798.90.54).",
      "effective_from": "2016-01-01",
      "effective_to": null,
      "sources": [
        {
          "title": "Civ. Code § 1798.90.51 (Added by Stats. 2015, ch. 532, § 3 (SB 34), effective 2016-01-01)",
          "url": "https://leginfo.legislature.ca.gov/faces/codes_displaySection.xhtml?lawCode=CIV&sectionNum=1798.90.51.",
          "accessed": "2026-10-02"
        }
      ],
      "review": "verified"
    },
    {
      "rule_id": "ca-civ-1798.90.52-access-records",
      "citation": "Civ. Code § 1798.90.52",
      "actor": "ALPR operator",
      "activity": "access or provide access to ALPR information",
      "duty": "If an ALPR operator accesses or provides access to ALPR information, it shall (a) maintain a record of that access including, at a minimum, the date and time of access, the license plate number or other data elements used to query the system, the username of the person accessing the information and, as applicable, the organization or entity with whom that person is affiliated, and the purpose for accessing the information; and (b) require that ALPR information only be used for the authorized purposes described in the usage and privacy policy required by § 1798.90.51(b).",
      "exceptions": [],
      "remedy": "Civil action by a harmed individual against a person who knowingly caused the harm (Civ. Code § 1798.90.54).",
      "effective_from": "2016-01-01",
      "effective_to": null,
      "sources": [
        {
          "title": "Civ. Code § 1798.90.52 (Added by Stats. 2015, ch. 532, § 3 (SB 34), effective 2016-01-01)",
          "url": "https://leginfo.legislature.ca.gov/faces/codes_displaySection.xhtml?lawCode=CIV&sectionNum=1798.90.52.",
          "accessed": "2026-09-30"
        }
      ],
      "review": "verified"
    },
    {
      "rule_id": "ca-civ-1798.90.53-end-user-usage-and-privacy-policy",
      "citation": "Civ. Code § 1798.90.53",
      "actor": "ALPR end-user",
      "activity": "access or use an ALPR system",